Company,Model,Year,Reviewer,Date,Title,Rating,Review
bentley,continental-gt,2005,Guy Brady, 10/08/2016,You better have deep pockets,3,"These are a great status car, you'll impress everbody that sees it. You can steal these cars second hand, but there is a reason for that. My suggestion is put $50k in your repair fund, you'll need it. For the same amount of money you can buy a Lexus 460 or a S550 Mercedes. Or even a 7 series BMW. Do yourself a favor, avoid the divorce.  When you see one at a unbelievable low price. Keep walking!
"
bentley,continental-gt,2005,Bent, 03/23/2009,its great when it is not in the shop,3,"The car handles great and has plenty of power. The interior could be a little better thought out, but only a minor issue. Reliability is a huge problem. There is an electrical bug somewhere in this car and the Bentley service has been poor at best. The car has been in the shop at least 5 times in the last year, and it is still not right. Dealing with the problems has taken all the fun out of this car."
bentley,continental-gt,2005,John, 11/04/2015,BUY 2 - youll have 1 to drive when other in shop,1,"NEVER BUY USED -  Bought a 05 and everything from Air Struts ($1350 each X 4 plus labor ) Rear Brake Window light, Plastic Vacuum Line ( PLASTIC IN A $250,000 car???  with engine temperature like it has??????? )

Looks great and drives great - When it is running - To much to fix when they are used. - 

High yearly Cost 
High Maintenance Cost

FIND INDEPENDENT MECHANIC - Unless you have MILLIONS -   

Just looks good in the Driveway - Prefer Vintage Rolls Royce -  Much more reliable - 

CAR FOR SALE -  Low Miles ( 44000 - coz its usually lives in the shop  LOL ) Beautiful Green with Beluga beige interior - 21' Bentley Tires'Rims - All Service records - AND THERE ARE LOTS !!!!!!!!!!!!!!!!!!!!  --  make offer - - Can be yours for a Steal of a price -
"
bentley,continental-gt,2005,keith, 06/18/2006,A Quality Ride,4,"After a Mercedes-Benz S55, the Bentley has restored my faith in expensive quality cars.  The driving experience is all that I expected and the quality of build inside and out is first rate.  Its performance is astonishing for such a heavy car but it translates to relatively poor mileage.  The stereo is great but sat/nav is fiddly to use and very basic in its features.  Servicing has been hassle free with all costs covered under the warranty and the dealership has taken care of any problems.  The rear seat accomodation is tight but if I wanted a 4 seater I would have got the sedan! All in all I am very satisfied with the car and it fulfilled all my expectations.  I highly recommended it."
bentley,continental-gt,2005,05bntly, 03/11/2005,Terrible electronics,3,"This car is absolutely gorgeous, is a blast to drive, 
but it is the worst quality new car I have ever owned.  
The electronics in the car fail in one way or another 
about every three weeks.  One fourth of the miles 
on the car have been put on going back to the 
dealer for repairs.  It is so bad, the car now 
qualifies for a buyback under my state Lemon Law.  
I am very disappointed with the quality of the 
electronics.  Also, the customer service is very 
much below my expectaions for a car in this price 
range.  My advice to anyone considering buying one 
is to wait till they get all the bugs worked out of the 
electonics in the car."
bentley,continental-gt,2005,Ernie, 06/10/2005,"Nice to look at, disappointing to own.",3,"This car is a big disappointment.  I'm a car nut, and the interior is gorgeous.  But the car is no fun to drive.  Visibility is terrible, drivetrain doesn't harness power smoothly, and dealer experience has been lousy.  By comparison, my 2004 Jaguar XJR is a delight to drive and a bargain-- at half the price, it's very fast, has MORE features, has never even required dealer service and handles with nimbleness the Bentley can't approach.  The Bentley is a stop-light ego builder, no doubt.  But it feels like a date with Madonna might feel-- everyone looks at her and envys you, but somehow when you're alone together you realize she's not the woman you want so spend your life with!"
bentley,continental-gt,2005,Dan Houk, 09/03/2015,Good looks can be deceiving,1,"Beautiful car that turns heads. Cost of ownership is very expensive. I have spent over $70,000.00 since I bought the car new in 2005. The repair cost doesn't count the items that needed repaired that were under warranty. This is my first and last Bentley GT
"
bentley,continental-gt,2005,KEITH, 05/21/2005,Bentley - Major Disappointment,2,"My Bentley Continental GT was tons of fun for about three months, but now every punk kid is driving one!  It has electronics issues galore.  Also, this is an extremely heavy car that does not handle like I had expected.  Its engine is superior, however its ergonomic design is not up to par either.  I should have bought the Aston Martin or Ferrari."
bentley,continental-gt,2005,John Telerico, 05/31/2005,Next Time Around Will Be Ferrari!,3,"The interior of the Bentley Continental GT is pretty, but it has no headroom even without a sunroof.  This car also has poor overall handling.  The engine is strong off the line and above 70 mph.  Its braking is no better than a Lincoln Navigator's.  The Continental GT is just too heavy.  If you are over 6 feet tall, forget about comfort.   Its quality has not met my expections, especially considering the fact that I had to wait a year for my ordered car to come in.  This is a good car, it's but far from great.  It truly does nothing great."
bentley,continental-gt,2005,Jimbo, 07/21/2005,As Good as it Gets,4,Awesome performance.. Had MBz for 25 yrs. -- build quality of the Bentley is awesome.  Dealership experience great.  Has some quirks -- what good (anglo/german) product doesn't.  It's a different level of ownership experience.  Service -- awesome.  Have my order in for Convertible -- only way anyone will get Gt out of my hands.  
bentley,continental-gt,2005,R. B. Tonkin, 06/07/2005,2005 Bentley GT,4,"I have only driven my Bentley Continental GT some 500 miles so far, but it has been flawless perfection thus far.  It has exceeded my expectations in every way.  Even fuel the mileage, which is low, is adequate as this car weighs over two and a half tons with over 550 horsepower. It is quiet, smell of leather is so pleasant, and tactile swithchgear is perfect."
bentley,continental-gt,2005,Overlord, 07/14/2006,Muscular torso in a Savile Row suit,4,"I bought this car for the interior and it doesn't disappoint - except perhaps the plastic display surround.  The leather and wood is heavenly and reminds you of the English craftsmanship clothing the largely German dynamics.  The latter is reassuring, since I have had an unpleasant ownership experience with an old school Brit supercar, the Aston Virage.  The car is undeniably heavy, but the 4wd deals well with the power, and good drivers can push it further than you might suppose.  However, dynamically it would be outpaced through the bends by some of my other cars - Ferrari 550, 911 Turbo, Noble (small volume English rocket!)  Still, for elegant trundling, it beats any Merc, BMW or Audi.  "
bentley,continental-gt,2005,D. A. Yergey, 09/03/2005,2005 Bentley Continental GT,5,"This car is the best car that I have ever owned. The performance is breathtaking. The finish work is superb. The interior is very usable. The back deat is far more usable than I expected, particularly for a 2-door. Even the GPS system is more usable than the Mercedes that I traded in. All in all I give it a near perfect score. Resale is excellent also."
bentley,continental-gt,2005,S Stein, 12/16/2004,Outstanding car,4,"Fun, to drive, well built and very 
luxurious.  Great sound of motor.  
While I love my S55 prefer this for 
everyday use.  Turns heads all the time"
bentley,continental-gt,2005,St. James Red, 08/26/2006,2005 Bentley Continental GT,5,I am a 60 year old maried businesman.  We also own a 2006 Jaguar VP and 2004 Mercedes S500.  I cannot drive this vehicle without someone giving me the thumbs up. This vehicle is the ultimate driving experience. 
bentley,continental-gt,2005,B. Olander, 06/04/2005,THIS IS IT!,4,"The 2005 Bentley Continental GT has outstanding build quality. Other manufacturers now need to play catch up.  Bentley has been able to maintain the ""Bentley image"" with help from the Volkswagen/Audi infusion of capital. This car's engine wants to run, with tons of hp and torque. The leather inside is of the finest quality. This model's limited production should keep it a classic. Except for the twin turbo charges, i believe W.O. Bentley himself would have approved of this car.  It has power, power, and more power in one really slick package."
bentley,continental-gt,2005,J. R., 04/18/2006,Love It,4,This is the car! I've owned a few luxury cars and a few Ferraris' and this car is a great compromise between an everyday driver and a weekend fun car. It's very practical for everyday use with loads of performance for those spirited drive times.
bentley,continental-gt,2005,Ken Dialo, 06/12/2005,Continental GT- Smoke and Mirrors,2,"This car took me a long time to receive. After 3 months not satisfied. Engine is strong, but does not prove out to alleged specs that are reported. Porsche all models will give it a solid run to 60mph.  Handling is sloppy, braking is not world class. Interior is beautiful, controls are nicely placed.  Overall I will purchase Ferrari or Aston on next trip around."
bentley,continental-gt,2005,TED G., 06/16/2005,One for the Ages,4,"While I waited for delivery, I asked an existing owner how he liked the the car; ""I don't like it.....I love it!"" End of story. It is clearly the best luxury porformance car I have ever owned. The blend of styling, performance and engineering is unsurpassed! I look for reasons to take the car out, it is that much fun to drive. I just took my first ""road trip"" through the mountain passes of Washington State and it handled flawlessly. This is as close to perfection as I have seen in a mechanical structure!"
bentley,continental-gt,2005,Blake, 08/01/2005,Bentley Continental GT,5,Smooth to drive and a LOT of horsepower. Before I bought the GT I test drove the Aston Martin DB9. Theres nothing like a Bentley compared to the DB9.
bentley,continental-gt,2005,bob, 01/29/2005,Bentley did it!,4,"I just picked up my Continental GT last week. I have only wonderful things to say about it.  It is an awesome vehicle with a great combination of power and luxury. I previously drove a Mercedes-Benz and cannot believe the difference in handling and power between it and my Bently. My only complaint is that the cupholders are not really functional, but I can live with that issue."
bentley,continental-gt,2005,Len Tweten, 02/15/2005,Golfer,4,"I have owned many fine cars and this Bentley Continental GT coupe is without doubt the very best car ever,  My wife loves it as well. There are twenty of them here in Bighorn. I traded in my Aston Martin for this car and an glad that I did."
bentley,continental-gt,2005,David, 04/15/2005,My take on the Bentley Continental GT.,4,"I enjoy the Bentley Continental GT very much. It may not be the fastest in acceleration or handle the best but it is an all around solid car that performs very well in all catagories. The fuel mileage is not very good but that is to be expected from a 5,300 lb. car with a twin turbo 6.0 liter engine. "
bentley,continental-gt,2005,R. Olander, 04/17/2005,Time in Motion,4,"Wow! The Bentley Continental GT is a new benchmark. The interior workmanship is excellent and the exterior looks great from the front and side views. Its rear legroom is a liitle skimpy, but Bentley delivers on the 1952 Continental R concept. This vehicle will be a real classic. It was worth the wait."
bentley,continental-gt,2005,Raul Juan Escudero, 05/28/2005,Artwork on Wheels,4,"The 2005 Bentley Continental GT is an extraordinary car. As an ultra luxurious coupe it has no rival, except for the Ferrari Scaglieti, which is an entirely different automobile and is significantly more expensive. It is luxurious with an understated flair.  "
bentley,continental-gt,2005,Donald G. Santucci, 07/07/2005,Bentenly Continental GT Review,4,"Over the years I have had the good fortune to have  owned a few exotic cars. While the Bentley GT does not have the, ""outer edge"",handling of some of the Ferriaris, Aston Martins and some other exotics, it is truly a high performance car, but without the harshness exhibited buy most of the other cars of it's breed. As for the over all handling, it should be more then adequate for 98 percent of the people out there that buy these kinds of cars. Personally I don't mind giving up some preformance, that I'll never need, for a little more refinement and creature comfort.    "
bentley,continental-gt,2005,anthony p browne, 05/08/2005,Bentley GT,4,"Get used to all the looks and whistles on the road.  The 2005 Bentley Continental GT is an eye catcher! Its performance is fantastic, and the roar from the exhaust tell you so. The old fashioned smell of leather and wood brings back memories. I'm 6'3"" and 210 pounda and this car isn't made for people my size but it's like shoes, if I like them I'll squeeze in. Nothing in this world is perfect, but this Bentley sure is close."
bentley,continental-gt,2005,perrie, 05/08/2005,2005 Bentley Continental GT - Love it,5,"The 2005 Bentley Continental GT is the greast ca in the world.  It's fun to drive, superior to my Mercedes-Benz S55 and almost as much fun as my Ferrari 360.  It has excellent build quality, pickup, and styling.  Iave already ordered a Bently Flying Spur.  This car is a real head turner."
bentley,continental-gt,2005,tom wartenberg, 07/16/2005,Best Car I've ever owned,4,"I'm a car junkie. I've owned every exotic and luxury car you can think of over the last 30 years, including a prior Bentkley Turbo R, which was a trash can that I dumped in 6 months.  This, however is the finest car I've ever deriven . Puts the big BMW, Mercedes as well as the Porsche's and Jaguars of this world to shame."
bentley,continental-gt,2005,charles winner, 07/18/2005,I love driving the car,4,I have several cars ranging from Aston Martin Vanquish to Mercedes to BMW and a Bentley Arnage. The GT is by far the one that I prefer to drive. I highly recommend it to anyone that can afford such a car.
bentley,continental-gt,2005,BocaBentley, 09/22/2005,GT Rocks but blows fuel quick!!,4,Nothing bad to say except for the amount of gas it takes to go down the block. The car is a true masterpiece.
bentley,continental-gt,2005,larry sarf, 11/25/2005,The Best of the Best,4,The 2005 Bentley Continental GT is a great automobile.  Its comfort is unbeliveable and its performance is so surprising.  It definitely is the greatest car I have ever owned.
bentley,continental-gt,2005,Christopher Kent, 12/19/2004,2004 Bentley Continential GT Rocks!,4,"Love this car.  I have owned many high 
end sports cars, but this takes the 
cake.  Had to pay $30,000 premium to 
get it from the dealer's floor or wait 
15 months.  It was a no brainer.  No 
regrets."
bentley,continental-gt,2005,AJ, 01/02/2005,2005 Bentley Continental,5,"I just got my 2005 Bently Continental and I love the car.
From the interior to the exterior this car is amazing.\
This is probably the best car I have ever purchased.  If 
you are Bentley entusiest this car is a MUST. "
bentley,continental-gt,2005,Greg Bradford, 02/06/2005,Luxury and Power,4,"The feel of being pinned to back of 
your seat while you accellerate this 
5300 lbs. of luxurious automobile is 
unbelievable.  Every one of my friends 
that get in this automobile exit with a 
smile.  It trully is the an amazing car 
on the long and the short trip.  "
bentley,continental-gt,2005,George Molnar, 08/21/2005,love the car,4,"Beautiful, yet understated.  Drives like a dream.  Uplifiting to drive, great overall feeling.  Getting in and out of the back seat is difficult."
bentley,continental-gt,2005,Herodotous, 06/17/2005,A Fine Car,3,"The 2005 Bentley Continental GT is a fine car to drive even though the electronics seem to act up once in a while. It joins my other fine cars: Lamborghini Murcielago, Ferrari 360, Aston Martin Vanquish, Porche Carrera GT, Ferrari 612 Scaglietti, Maybach 57 (custom made), and Mercedes SLR, with the last been the best but at $600,000 it is hardly the car to go shopping with! The Continental could probably lose some pounds as it detracts from its performance.  Overall, its not bad for a VW."
bentley,continental-gt,2005,delighted owner, 12/28/2020,Superb and Reliable Superstar,5,"car surpasses expectations even though 15 yrs old
"
bentley,continental-gt,2006,Gil Amoroso, 08/14/2006,Fabulous Vehicle,4,I couldn't disagree more with the naysayers of this automobile.  It's not only beautiful and fast but it's great to drive.  It has superb handling for a heavy car but I'm not Mario Andretti.  The gas mileage is awful but what would you expect from a 550 hp vehicle?  A Prius it's not. Its build quality is great and I've had no problems so far.  It's a real head turner wherever I go.  .I'm very happy with the purchase.
bentley,continental-gt,2006,Ryan Andrews, 04/21/2006,The Bentley,5,"This is one fantastic car. It's fast, handles well, has great looks, and has a Bently badge which makes it that much better. I like to drive with the paddle shifters, tap the left one to downshift an the turbos propel you to great speed within seconds an lets you hit very high speeds, which doesn't take very long. Its steering accuracy is superb at all speeds which makes the car feel lighter than it is. It wieghs about 5,200 pounds, but the steering makes it feel like its a mere 2,100 pound Miata. The brakes never fade or give up, I went from around 80 to 0 mph with in a few seconds to avoid rear ending a car in heavy LA traffic, most cars would have squeky, faded brakes, this thing never gives up. I love it!"
bentley,continental-gt,2006,bob, 01/07/2006,Nothing Else Quite Like It,4,"Having been the owner of Merdedes, BMWs, Porsches, and quite a few others, the Bentley Continental GT is far superior in all aspects.  Its power can only be understood by being in the driver's seat. This car is ell worth the dollars. I give applause to the Bentley design team."
bentley,continental-gt,2006,2andout, 03/29/2008,2006 Bentley Continental GT,4,"Power, handling, braking is superb. Enough GVW to be classified as a light truck but nimble as a Ferrari in the turns. Quiet yet throaty. This is the best car in class that I have ever owned. Double insulated glass. Everything leather. Check out the interior trim. Hardly a sign of plastic anywhere. I rate this car based on performance, appearance, reliability. I give it 10+ in every category. It has bluetooth yet the iPhone does not work with it. The navigation in the 06 is by cd, not the greatest. Nobody's perfect."
bentley,continental-gt,2006,Roger Marchs, 01/21/2006,"Bentley Good, but Not Great",4,"The Bentley Continental GT is comfortable and darn fast.  However too its console contains too many shared Volkswagen/Audi parts.   Come on, for $165,000 I don't want the Audi controller, nor do I want two paired Volkswagen 6 cylinder engines bolter together for a total of 12.  This is a pretty car and its very comfortable.   It's almost great, but not quite there."
bentley,continental-gt,2006,THE CONSULTANT, 12/20/2006,A Bently is Still a Bently,4,"The Continental GT, which I have owned for two years, is an eye catcher.  If you seek attention, look no further, The car performs well for its size, but Bentley was a little careless with some of the interior features, none of which compromises the car's driveability.  For example, the seats really need more adjustment positions, the phone system is antiquated, and the command system leaves a little technology on the table, but other than that they did a great job."
bentley,continental-gt,2006,Let down by Bentley, 02/18/2007,Disappointed in Bentley,4,"This is a great car with one major exception. Using the phone, after you dial a primary phone number there is no way to dial an extension while driving. I can't use the car for business calls. The car sits in the garage. If you need to use this car phone to dial an extension after you dial your office, forget it. Make sure to check it out for yourself before purchasing this car. I would like to get a Flying Spur but with the phone the way it is, I'm getting a MBZ S600 or S65. Also, if you are tall the seat belt pulls down on your shoulder. Last, the air conditioning is weak. All this being said, this car is a GREAT drive."
bentley,continental-gt,2007,The Man, 08/29/2007,The Bentley that Reinvented the Name,4,"From the day that I took delivery of this car my life has truly become more interesting! I couldn't help but sit in the car for the majority of the first day, whether I was driving somewhere or I was in my garage. The interior is literally unparalleled in the current automotive market.  The outside is a perfect complement for the goregous interior. With sweeping lines that run the length of the car, the Bentley Continental GT still reminds me of the old carriage cars of the early ninties, which is so rare to see in modern cars.  The performance is amazing, handling, acceleration, and top speed are all great for a car that is as comfortable as it is, and that weights 5300 pounds!"
bentley,continental-gt,2008,pb, 12/05/2009,Best Car I have EVER owned,4,"Traded my 07 maserati QP for a new 2008 GT, the car is absolutely amazing, insane amounts of power and torque can be driven like a limo or spanked like a true sports car. The interior is the best I have ever seen, bluetooth works fine, back up camera is a great help, ride is silky smooth and in my opinion this is the sexiest car on the market today (with a 599 a close second). I have not yet driven the car in winter conditions, but the 7000 miles I have driven over the past 6 months have been most enjoyable..."
bentley,continental-gt,2008,jordegcam, 06/10/2008,Car of Cars,4,"Traded in my 2006 Maserati Gransport for a 2008 Black Bentley Continental GT Coupe. Wow! The styling is all at once beautiful, sporty, elegant, and eye-catching. While I miss the throaty roar of the Massy, the elegance and power of this Black Beauty is enthralling. The creature comforts, the interior, the modern features are beyond compare. This has to be the world's best car. The Bluetooth feature apparently has been improved, my iPhone works well with it seamlessly. The drive is comfortable, yet very powerful. With a 0 to 60 of 4.6 seconds and 552 horsepower, this is a far better buy than a Ferrari Scaglietti, in my opinion. No regrets so far after 5 days! "
bentley,continental-gt,2010,Steve D, 05/17/2010,"Fabulous, except...",4,"If you are in this class, you have some expectations.  The car is wonderful to drive, stunning curb appeal, and incredibly powerful.  Meeting those expectations.  However, the 7 year old BMW 745 Li I traded in had much more advanced electronics.  It gets a 5 in reliability because the battery drains from starting W-12 engine after about 10 days of around town driving and must be plugged into an external charger.  The car starts, but no stereo, SatNav or other accessories.  Overall, it is a thrill every time I start the car and all my friends always want me to drive them to dinner."
bentley,continental-gt-speed,2008,Gujju_Power, 03/21/2010,Excellent rocket but not so practical,3,"Owned tons of expensive cars, by far the easiest to drive with a powerful engine to boot. Excellent styling inside and out. It is like a rocket ship. People slow down to take pictures using their cell phones. But, yes, there is a but because when you spend $200,000 you expect the car to play MP3 CDs, don't expect rattling sounds from the headboard, and chirping sounds from the child safety clam in rear seat. You expect the car to be totally unique but not. It is uses the EXACT same technology as a VW Touareg I had owned. Check it. Side panels vibrate when radio is loud. The road noise is terrible. Worth the money as other cars like lambo and Ferrari not user friendly and cannot be driven daily."
bentley,continental-gt-speed,2008,Jeremy, 04/02/2008,Performance and comfort,4,"The Continental GT is an exotic car that can actually be driven everyday.  The Speed takes it up  notch.  Even faster and the optional carbon ceramic brakes are pricey, but offer stunning stopping power.   (The brakes also offer no noise, no brake dust, much lighter weight and will last for 180,000 miles!)  An elegant exterior and the interior sets a new standard in quality and detailing.   "
bentley,continental-gt-speed,2008,Robert Reams, 11/04/2016,Best car ever!,5,"My forever car!
"
bentley,continental-gt-speed,2008,Steven , 08/01/2008,Once Upon a Time...,4,"She's Breathtaking, Stunning, Exotic, Sexy, Fun, Powerful, Plush, Elegant, Touches your Soul, Beautiful Coming or Going and what a sound she makes ... need I say more?   "
bentley,continental-gt-speed,2008,Dr. Joe, 06/07/2019,Arrive in style,5,"The Continental GT Speed which I own is a somewhat rough ride on irregular surfaces like we have in New Jersey because of our rough winters. I presume that this is because it is set up for extremely high speeds on 20"" rims and P-Zeros.   Nothing smoother on smooth highway surfaces.  Unbelievable power and smoothness.  Car doesn't really wake up until 92 mph when the airfoil on the back deck automatically pops up and you can actually feel the car squat down.  Really more power than you could ever need.  Regular Continental GT probably a better choice unless you are a macho man or want to take it to the track for some kicks and blow away the Porsches and Ferraris while riding in supreme luxury listening to the best stereo you ever heard in a car  with the A/C on full blast.
"
