Company,Model,Year,Reviewer,Date,Title,Rating,Review
bentley,bentayga,2018,Larry Keller, 08/28/2018,Software problems with new electronics,3,"This is our fourth Bentley that we have owned. We purchased a 2018 Bentagya in November 2018. Currently we have 7200 miles on it and this is what we have encountered.
This generation of Bentley has a new set of electronics compared to the last three we owned. We do not like this new set of electronics, the car is very unpredictable and not user friendly. We do not feel this is a SUV that you can relax and drive. You need to be attentive to certain situations that can occur.
For example every time you turn on the air conditioner and / or heater, you must set your settings each time, (windshield, dash vents, or floor). You need to press more buttons to get the system to work. I have figured out that you need to set up the air system before you start driving due to the time to set up and not looking at the road.
The driver door does not close automatically and will cause the parking brake to come on, whenever you stop. See more in other paragraph.
Bentley has also designed a shut off mode for the motor, that is on unless you turn it off each time you start the car. If you forget to shut off that button or change modes, watch out. You will go to push the gas at a stoplight and nothing will happen, then about the count of 3, BAMMMMM!!! Your car shoots off thru the light. We have almost rear ended several cars because of this. You go to push the gas and nothing happens, you wonder what happened, and then it starts and rockets off. 
The front end collision braking system has activated several times on me, and once on my wife, when there was nothing close to the front of the car. When this occurs it almost throws you thru the windshield and makes you nervous each time you see the red light in the dash light up.
The biggest problem we have had is the driver door will not shut automatically with the motor all the time. Sometimes it shuts and sometimes it does not. If you restart the car, it will work (electronics). We took it to the dealer; they tried to update the system with a software update. It did not work. Our door still does not close and now they want to order the part to fix it. I think it is more of an electrical problem than part, but we will see.
The day before we had the car in for service, I had a low tire light come on, so I asked them to fix it. I was told when I picked up the car that they could not fix the tire because the tread was too low and it was against their policy to fix tires in that tread range. Keep in mind that the car only had 6900 miles on it at that time. So my question is, are the tires on the Bentagya only good for 10,000- 12,000 miles? I guess so. Expect to replace your tires after the first year of driving, due to the cheap tires they are putting on them.
This Bentagya is not the SUV that we were hoping for when we purchased it. With what we have encountered so far, I would suggest a Range Rover and save yourself $130,000.
"
bentley,bentayga,2018,Gersalv, 08/07/2019,UNSAFE TO DRIVE,1,"I own a 2018 Bentley Bentayga. It is everything they say about handling, car colors, speed, etc. Hoever what is NOT said is the car' s safety. After only 8800 miles, I took my car in for the first service, which I thought would be routine oil change, filter, etc. I was horrified to learn that my brakes were dangerously low! I had to not only replace pads but rotors as well which had already been damaged. The service manager at the dealer told me this is a common problem with this car. I am an elderly woman who drives to Dr's apts, church, shopping, etc. I called Bentley numerous times for an explanation. Customer Service told me the Regional Manager would call. After not less than 5 calls, he has yet to return my call. 
You take your life and the life of your loved ones  in your hands driving this  car.
"
bentley,bentayga,2018,Bryce, 10/26/2019,Simply amazing,5,"I simply have nothing bad to say about this incredible work of art.  I drive mine fast and hard.  I always turn off the auto engine shutoff on every car I drive.  This is now standard in every high end car.  O -145mph feels the same as 70-150mph.   No jerk, no stall,  you are just instantly gone.  It is like a jet engine with no gforce.   I have recommended one to all my friends.  Super comfy as well
"
bentley,bentayga,2019,Jon Wilson, 07/22/2019,"Yes, pure amazing",5,"There’s nothing really to say, accept this car is amazing, the one problem though, is the price. But that’s really all there’s to say! So I recommend this car!
"
bentley,bentayga,2019,John Kidd, 02/11/2020,John Kiidd,5,"VW had a lot to say with the Bentayga, Urus and others within the group. Season, save money on underspend designs. The Bentayga is a stunning Suv. Don't need luxury in the boot, but Bentley do give you some expensive options.The audio is excellent but the MMI could of been upgraded. Install a wide body Mansory kit for about £85000 (Not cheap) but it makes the motor Amazing, try and keep away from keeping the bonnet & radiator couling Carbon look, if painted with the right body colour, it will look Stunning"
bentley,bentayga,2019,GVH, 02/05/2020,German luxo rocket with traditional English issues,4,"Not pretty but imposing. Excellent interior with 1990s infotainment .The W12 engine is a rocket while its trasmission while fast and precise, is too ""reactive"" and switches gears too often at medium speed city traffic Excellent ride and silence, very polished.Does not feel as big as it is behind the wheel. Glitchy warnings scare you with alarming messages such as drive system fault!
"
bentley,continental,2002,Al Edmond, 08/04/2002,Al's Bent,5,"Its been the greastest car i have ever
owned, i get looks from everyone and the
girls just come and run to me when im in it."
bentley,continental,2002,joel, 02/28/2002,wow,5,i love this car!
bentley,continental,2002,Big Balla, 03/31/2002,My Bentley,4,"Great Car, but only for the financially stable....  Ha! Rides and handles great, awesome acceleration."
bentley,continental,2003,TOADY, 04/26/2003,SWEET CAR,5,"I had this car for about 3 months now 
and Im obsessed!  The car handles 
great, rides like a cloud."
bentley,continental,2003,SM, 12/30/2019,car window falling apart,1,"car window falling apart. Over $5000 to fix
"
bentley,continental,2018,TTJ, 07/04/2020,Car of your dreams,5,"This car is easily one of the most sought out cars in awhile
2018 Supersports Convertibles  are rare used . Only 150 made it to the US This is your last beautiful ride 
Smooth , incredible power. Beautiful , Quiet ride . With the windscreen , the Top down is beautiful.  Lamborghinis and Ferrari’s are showy 
Everyone who sees this car is intimidated and inquisitive. Many just want to sit in it
You can actually drive this around town 
Just a true obsession
"
bentley,flying-spur,2014,Happy Mom, 12/29/2016,A Heavenly Ride!,4,"I have driven many luxury cars, Mercedes, BMW, Maserati, Jaguar, to name a few, but this ride by far, is like no other! On a scale of 1-10 I give it a 12 in comfort and the same for it's impressive look. My only issue is that I'm a tech-lover and it seems to be that even this updated version (I previously owned a 2009) doesn't offer the same technology as, say the Maybach or even a simple Mercedes GL (which I had as a loaner car and appreciated the technology). So I'd say that's the only thing it lacks but otherwise it's one helluva machine!
"
bentley,flying-spur,2014,Suzie Villere, 06/14/2020,Looks and runs like a Bentley!,5,"This is not for the faint of wallet, but is a car you can own for a couple of decades.  Bentley styling is timeless... the 1990s-era Arnage still looks handsome and stylish today.  The materials are the very best, and the fit and finish is unparalelled."
bentley,flying-spur,2015,Abe, 12/13/2015,>2 minutes tin can,4,"The review after 3 years with about 23,000 miles:
I really did not have any problem with anything except with the display unit. It kept freezing and not responding to any touch/button unless the car is turned off and turned on again. They replaced it under warranty but I understand it would have been >$6K items if I had to pay. Other than this there has been no other issue. Car is still very nice to drive and feels as good as new. Of course there has been NO fix the to electronic performance that I mentioned below. It is pity for a car like this to have such terrible electronic performance. Cars with 1/10th the cost has better electronic performance. Apparently this was a known issue even on the previous models. Some body should have been fired over this!
By the way, I have V8  Flying Spur not V12 as the heading says. I could not navigate to change it to V8.

I have 2015 Bentley Flying Spur V8. This is how long it takes for it to load up the phone files and it takes almost 25 seconds for the rear camera to come on in the morning. When you go over the road divider rectangular reflectors it makes noises that makes you think you are driving ""PINTO"" It actually ""accelerates"" when you want to decelerate in cruise control mode before it decelerates. These are some of the features that Bentley calls ""normal"" It took repeated calls and days for the Bentley customer service manager to call me back. Other than some of these problems, it is a beautiful car, fun to drive, quality finishes all thru. Information system is actually pretty functional and intuitive but its performance sucks! It is a big car but it feels sporty and connected to the road. It would have been really a great car if it did not have these problems that Bentley calls normal.  I have about 6K miles on it so far and it had no mechanical problem.
"
bentley,flying-spur,2015,Charles Jones, 07/01/2016,Fantastic!,5,"The 2016 Flying Spur is absolutely perfect.  The interior quality and finish is second to none, as expected.  The thing that surprised me the most is how fun the car is to drive.  You cant hear a thing when driving in the cabin.  The ride is so smooth I didn't even notice I was going 100 mph until I looked down and the beautiful instrument cluster.  Purchasing a radar detector is certainly a good idea. This is a heavy car but it corners and handles like a dream.  Put it in sport mode and you actually have more power then you know what to do with. Took the car over a windy mountain pass and I was simply amazed at how well the car ate up the curves.  Coming from an S550 4matic there is really no comparison between the two.  Totally different driving experience in a good way.  Oh, and its also nice when passengers from other cars are taking pictures of the Flying Spur as you drive by.
"
bentley,flying-spur,2018,Bhullar, 10/21/2018,Fair deal,4,"Great luxury CAR ,I own 2018 custom made of order. But inside gudgets  and  latest tech like blind spot indicator,chamber for sunglasses, navigation tool. definitely poorer then my S550 mercedes Benz 2017
"
bentley,flying-spur,2018,drputt, 03/24/2020,Superb,5,"drives like a dream
"
bentley,flying-spur,2018,Djlboston, 06/07/2020,It’s a yacht that drives like a speedboat,5,"I have the 2018 v8s. Classic black. It may not outperform the best from Mercedes and BMW, but it dwarfs them in class and scarcity. Worth every dime. 
"
bentley,mulsanne,2018,Joe Vansiniglia, 06/04/2019,It is truly impressive...but,3,"It's a very pricey automobile of dubious value compared to my vintage 1962 VW 1200 Saloon. Both get me exactly where I choose to go. The difference is the VW is so much FUN to drive!!

[non-permissible content removed]"
bentley,arnage,2001,BentleyBoy, 06/18/2008,Breathtaking!,4,"I quit keeping track in 1989 but, at that point I had owned over 160 cars. Nothing even comes close in quality, curb appeal, performance, unabashed good looks, handling, design, ride quality, even the smell of this car (including Rolls-Royce). Everywhere you go people will compliment and envy you in this automobile. Most can't even tell what it is! I currently own 4 Porsches , Ferrari Maranello, a Vintage XKE and 6 other American muscle cars but can't wait to drive this car at every opportunity. It simply takes your breath away. It's the 2nd one I've purchased. The dealer is 'proud' of his parts and will ding you unmercifully but, it's the price you pay to drive the Best Car On The Planet."
bentley,arnage,2001,AONINC, 03/31/2004,The Ultimate Luxury Car,4,"I drive this car for fun in nice 
weather, and I absolutely love it.  
Not many cars even come close to the 
superiority of this Bentley."
bentley,arnage,2001,CBMCESF, 10/26/2002,Bentley May Be Best & Finest Ever!,4,"The car is a living room with jet 
enginelike performance with a ride and 
handling as if on rails.  Simply the 
most elegant automobile currently on 
the planet; and it is all hand built 
too.  The ""last"" of the truly handmade, 
one of a kind (each) English motorcars!
Amazing; and all this for the price of 
a small, well located summer home. 
Imagine!"
bentley,arnage,2001,Ron George, 12/01/2019,Simply the best of the best ... and proven better!,5,"As an owner of too many cars to count and an avid fan of the 2015+ Mercedes S class motor vehicles, the 2001 Bentley Arnage R is the most exhilarating ride of all.  As soon as you open the doors, yes even on an 18 year old vehicle, the wreak of class overwhelms your senses.  You are first stunned by the elegance while simultaneously intoxicated on the smell of the finest Nappa leather and luxurious fleece carpeting then, while your feeling your image touched by a Madison Avenue PR firm, your ears are treated to a sound room designed for the most enthusiastic audiophile.  If all of the senses overload isn't enough, prepare yourself for jet-like power transcending you like a bullet-train with nary a road sound or rumple to disturb your dream like magic carpet ride.  Aladdin would gladly swap places with the lucky owner of this motor carriage!
"
bentley,arnage,2001,Brody Starling, 03/06/2002,bently,4,put rims on the car on the front page
bentley,arnage,2002,John Grartpak, 01/16/2003,Great Job,5,"I drive it every where I go and the 
ladies just love it.  I got it stolen 
once but I took care of that."
bentley,arnage,2002,Erick, 03/26/2002,Very Very Nice,4,"I have owned my Red Label for no more than a week and I must say that I have never driven a saloon anywhere near this quality. I though the S600 was nice but this, this is very very nice.
I will be looking into purchasing another for my wife, since she always wants to drive mine now."
bentley,arnage,2002,Irvin Chuck, 03/03/2002,Great Car,4,"This is an excellent car. I have just bought the Red Label and i think that even though it has a very high price tag, it is much better and roomier in the back than my 2001 S-Class. It is a lovely car..."
bentley,arnage,2002,FineDriver, 02/26/2002,Car Bulit to Please!!,5,"Exellent car, never will Have I ever owned anything so refined! I love this vehicle and love the responce I get when I drive through Down Town Houston."
bentley,arnage,2003,M.EGAN, 02/08/2004,THE FLYING BRICK,3,"BENTLEY ARNAGE T IS NOT FOR SISSYS. THE 
TWIN TURBO EFFECT GIVES MASSIVE 
ACCELERATION AT ANY SPEED. THE BRAKES 
ON THIS 6000 PLUS LB CAR ARE ALMOST 
ADEQUATE. IF YOU OWN ONE YOU WILL GET 
TO KNOW YOUR DEALER VERY WELL.I BOUGHT 
MINE WITH 9500 MILES ON IT AS A FACTORY 
DEMO,AT 12500 ALL FOUR TIRES WERE 
REPLACED AND ONE WHEEL. NAVIGATION 
SYSTEM WORKS 25% OF THE TIME,FALSE 
WARNINGS ON HYDROLIC SYSTEM & BRAKE 
PADS ARE A CONTINUING ANNOYANCE.THE 
ARNAGE T IS EXCITING TO DRIVE BUT MY 
GUESS THE REAL EXCITEMENT STARTS WHEN 
THE WARRANTY STOPS. THE FIRST DEALER 
QUOTE ON REPLACING ONE TIRE WAS $700. "
bentley,arnage,2003,Tombo, 07/15/2004,Splendid,5,"The best car ever! So luxurious! The 
interior as well as the exterior 
design, is so smooth and beautiful."
bentley,arnage,2003,M Burkhardt, 07/30/2003,Bentley,4,"Good!! The 2003 Bentley Arnage is the 
perfect car for anyone seeking quality 
along with performance. Test-drive the 
new Bentley, and you will see what I 
mean!!"
bentley,arnage,2003,the_real dude503, 05/04/2003,Great Car,4,"This Car is so great.  The only setback 
to it is the horrible fuel economy.  It 
is way worse than my Ford Explorer was."
bentley,arnage,2004,Jeff245, 01/31/2004,Bentley Beyond Luxury,4,"I currently own a Bentley RL.  It is 
Silver with top of the line options.  
the car has extraordinary safety 
features.  It is fast, agile, and the 
handling is superb.  I would reccomend 
this car to anyone although the price 
tag is extremely high."
bentley,arnage,2004,HSA, 07/24/2004,Miraculous Machine,4,"There simply is not a more amazing 
experience than driving a 3 ton ""living 
room"" at break neak speeds 
everywhere.   If cost is no object, 
Bently's Arnage is truly in a class all 
its own.  It has no equal."
bentley,arnage,2004,srmnj, 02/28/2004,Very Few Flaws,4,"Despite the size and bulk of the 
Arnage, it is a true rocket ship. First 
time riders are amazed at the 
combination of comfort and speed. Stay 
away from the LWB unless you plan on 
riding in the back 100% of the time. 
I've had both. They are very different 
cars."
bentley,arnage,2004,fp2c, 10/02/2004,Wow,5,best car in world
bentley,arnage,2005,michael salimbene, 03/06/2005,True oppulance and performane,4,"The 2005 Bently Arnage is by far the most exciting, 
not to mention luxurious sport sedan 
ever made!!  Every time I start the 
car (via the push button start) an 
uncontrollable grin is immovable from 
my face.  The car is stunning!  Having 
a good amount of experience with both 
the Mercedes-Benz S55 and S600 it would be silly to 
even compare the them to this car.  The 
fit and finish is pure artwork.  I 
highly reccomend this automobile"
bentley,arnage,2006,real tot, 12/29/2006,Bentleys Forever,4,The Bentley Arnage R offers serene and smooth ride.  It is a sure footed car with lots of room that's easy to park.  I like how its windows are large enough to see around very well.
bentley,arnage,2006,Lady Celeste, 10/05/2006,A Simple Review of a Marvelous Auto.,4,"Although a lady, I love driving. My Arnage has not disappointed me in the least. The fit and finish are top notch. Gone are the days when my Arnage would have made me special. I now must see Continental GT's and Flying Spurs daily on the local streets. Now my Arnage just brings me joy because it is such a wonderful automobile. It's quick without being startling. It's refined and stately. In a world where S-Class Mercedes Benzes are as common as Fords, the Arnage insures that I will not only arrive in style but in an automobile that is not as everyday as some lesser automobiles."
bentley,arnage,2006,Brent, 02/20/2006,Great car for everyday highway driving,4,"The 2006 Bentley Arnage R is a driving machine. I enjoy all aspects of the it.  It is a great conversation piece at gas stations, which I hit often with the 10 miles per gallon that the Arnage gets. Overall it is a great car."
bentley,azure,2002,Jagwoman, 03/09/2002,Not quite worth the cost...,3,"This car is beautiful, but I have other vehicles that compare quite favorably at a fraction of the price.  Buy this car for the status only, not for the performance."
bentley,azure,2002,Jagman, 02/13/2002,Wow,5,"This car is devine. I have longed for a Bent for a long time, and by the time this beauty came in, I was about to explode with anticipation. The second I turned the thing on, the engine almost made me wet my pants because of the roar that was produced. Every surface has wood and leather for miles and miles, and I could almost fall asleep behind the wheel, it's so comfortable."
bentley,azure,2002,tyrese, 03/30/2002,pleasent car,4,"to the people that say it is a waste of money to buy this car please go buy a bmw or a pontiac. This car is one of the most luxurious and comfortable rides in the world today and that why is priced like it is, i will buy next  years also and if it still worth it i will keep buying it.  to the high rollers this is a most."
bentley,azure-t,2010,kennethb1, 08/01/2012,The most beautiful automobile you can buy,5,"I owne a 2010 Bentley Azure T

This is one of the most beautiful automobile ever built.
It is extremely fast. It has a wonderful interior.
The exterior is just fantastic.
It is very quick,
Very high top speed.
Brakes exceptionally well.
The Bentley Azure T is very confortable.
The Stereo system is the best I have ever seen.
This Automobile turns heads.. where ever I drive it people look and take photos of it.. Everyone wants to sit in it..
I have a Rolls Royce Phantom,
BMW 6 series, Mercedes 650, and a few other cars but the Bentley is my Favorite.
It is the most beautiful"
bentley,azure-t,2010,Alex, 01/16/2019,High end collectability,5,"I bought this car in 2013 with 5k miles and have put another 4k on it. Its an amazing car to drive, elegant, imposing, and  extremely fast. The car's long wheel base on the Arnage chassis gives it the proper weight and stature on the road. Its a huge car, but the awesome design keeps the proportions well in check. This is the only modern ""super car"" in my garage (I own 10+ classics) and if maintained and treated properly will surely go up in value given the extremely low production and Bentley brand. Give it another 5 years and it will be a $300k plus car.
"
bentley,azure-t,2010,David Edwards , 08/07/2020,One of only 80 produced,5,"I have owned this Azure T since it was seven weeks old it has now covered 2960 miles serviced every year at Bentley Glasgow. This was the last T manufactured in 2010 and has total spec it resides with other rare models of Bentleys and is the jewel in the crown. 
"
bentley,continental-flying-spur,2006,bobbyo, 07/09/2010,Still good,4,"I agree with all the positive comments, which you'll note hint at some flaws in the design and operation of the car but do not in any way detract from the experience of owning one. I didn't see much substance in the negative reviews- was it the same guy writing them all? This car is fantastic, fast comfortable and smooth. Garners a lot (repeat, a lot!) of stares and comments. True luxury that mass-produced BMW's and MB's can't begin to match (Mercedes had to come out with the Maybach line to even try). My biggest complaint is the rear seat area, it squeaks rattles and shakes whenever you hit a bump, due to a suspension that is quite active and ""vocal"" over bumps. Reliability has been great."
bentley,continental-flying-spur,2006,SpineGod, 10/31/2006,Great Car,4,"I've had my Flying Spur since April. It is a great car and it is not ubiquitous like all other luxury sedans on the market today. It is fun to drive, has a huge trunk, and accelerates like a sports car. If it had iPod integration, it would be the greatest car ever. That said, I love these new Bentleys. I can't wait to get my Continental GTC."
bentley,continental-flying-spur,2006,davidhart, 04/23/2011,After 4 yrs I still LOVE to get behind the wheel..,4," In my lifetime I've owned some pretty special cars but my Flying Spur is in a class alone and far above any of the others.
After 4 yrs. I still anticipate with excitement my next drive.
It's a head turner (95 % favorable but a few truly nasty and envious remarks shouted out) and a delight in all ways from remarkable comfort, performance, uncompromising quality of construction and materials, and understated elegance inside and out.
The only comment I can make even slightly negative is that I noticed a improvement in ride, quietness, and handling when I changed from the factory-installed Dunlap tires to Michelin Sport A/S Plus 275/35 ZR20's.
I feel it's not hyperbole to rate it 5 stars."
bentley,continental-flying-spur,2006,Charles, 08/21/2015,Can afford this car 10 years later,5,"This is a very special car, not your daily driver. 10 years later exterior quality still better than most new cars, interior good shape but color of wood/leather show slight age but still impressive since it's all leather and wood. Bought it for fun so use it occasionally, feels pretty good paying just 1/3 of the original price with very low miles. Can buy a new LS460 or this10 year old Bentley for around the same price, I'm very happy with my choice especially I'm just half the age of other Bentley drivers =P
"
bentley,continental-flying-spur,2006,SAEarly, 09/13/2006,Flying Spur is in a Class by Itself,4,"A super luxury sedan with 4 wheel drive, 0 to 60 acceleration in 4.8 seconds, and a top speed of 195+ mph (magazine reviews) is not available anywhere currently in this price range except from Bentley. Austin Martin is planning something in next 2+ years. The super huge trunk is great for trips but the acceleration at any speed makes it fun to drive even though it weighs about 5,500 pounds. Our Beluga exterior with chrome wheels and Cognac/Beluga interior looks stunning. Other drivers have actually backed from other lanes at red lights to do a double take. While drivers going the other way have stared or even turned around to get a better look.  This car is very roomy, has stunning looks, and has great acceleration and speed!"
bentley,continental-flying-spur,2006,WJR, 02/18/2007,Spur vs. Arange,4,"I traded in my Arnage T for the Spur and never looked back. The Spur has everything I wanted (except no MP3 hook-up) in an auto. Although the Arnage T turned more heads (who cares) the Spur outdoes it in every way, especially the interior! The Arnage felt like getting into a space capsule (I'm 6'1"") and was in the shop a good amount...the Spur on the other hand, not a hiccup! It delivers flawless performance, comfort and design (although the back end is a bit odd to me). I believe to have finally found that love match between man and machine with the Spur. "
