Company,Model,Year,Reviewer,Date,Title,Rating,Review
bentley,continental-flying-spur,2006,BobS, 02/23/2006,"Sheer Luxury, Built to Last",4,"Having owned quite an array of luxury vehicles over the past 30+ years I thought I'd become quite jaded. I loved my Jaguar XJ's but then moved on to the Mercedes S-class, owning 4 over the years (including a new 2007 for my wife). The time had come for something different--something which looks and feels superior. The Flying Spur is IT! No Mercedes sedan can compare with the WOW factor of this Bentley. And, the beauty, quality and craftsmanship of the interior places this car head and shoulders all others. While I have no doubt the 2007 S-class is the true standard of the world, there is a certain satisfaction in driving the much more exclusive Flying Spur.  It is a JOY!"
bentley,continental-flying-spur,2006,bb, 09/15/2006,Special Car,4,"I am very happy with this car.  Compared to my previous cars, the S55 CL65 and S550, this car is the best and gives you everything, like performance, looks, and ride quality. To sum it up I find myself looking for reasons just to drive it. The car has a way of making you feel special.  I see a lot of comparisons to the BMW 760Li and the S600, these are great cars but check out what they sell for only a year old.  They lose a lot of value very quickly.  I'm speaking from experience, I traded my '06 CL65 on the Bentley."
bentley,continental-flying-spur,2006,Dr Quick, 11/06/2009,DR. QUICK's Prescription for feeling good,4,"The car is amazing. You almost have to learn how to drive all over again because of the elevated performance. Love the weight and solid feel. The power is breath taking. Some lesser top brands seem to have more features, but nothing beats pulling up in Bentley. Nothing makes you feel more special."
bentley,continental-flying-spur,2006,perrie32, 12/20/2005,Outstanding car,4,"I traded in my 2005 GT since I thought the 4 door made more sense for an everday car.  Like the GT the interior is outstanding as is the overall build quality.  The Continental Flying Spur  is fun to drive even though it is a little less sporty than the GT.  It's more elegant.  It is very comfortable and has some nice features such as automatic trunk opener and cooled seats.  Also better it has doors, since they are not as heavy.  All in all, I have been very pleased with the car."
bentley,continental-flying-spur,2006,mikemgm, 01/16/2007,Great All Around Car,4,"The windshield cracked and the console display system went out in the first few months I had it.  Other then that, it's a great all around car. It has excellent power (though there is some turbo lag at the bottom), a smooth ride, it corners very well for a 5,500 lb. car, the AWD is great in the rain, and it is far more of a head turner then a MB or BMW.  The interior is luxurious.  If money is no option then what the heck, you can't take it with you!       "
bentley,continental-flying-spur,2006,icecofe, 02/21/2006,Goodbye S-Class!,5,"I have owned a Merecedes-Benz S-Class for 15 years. In the Continental Flying Spur, I have finally found a car that looks, drives, and sounds as good as the hype. It is heaven to drive and the quality is unbelievable. It was worth the wait. There is nothing like it on the road.  Its a sports car and a family sedan with class. "
bentley,continental-flying-spur,2006,MichaelF, 03/20/2006,Beats BMW 7's & MB600 Hands Down!,5,"The Flying Spur replaced our Mercedes V12 and BMW 7 series. There is no comparison. Power and handling in the Bentley is superb, however, the quality, craftsmanship and design is unbelievable. The electronics and navigation is intuitive, making the BMW ""I-Drive"" look far more complicated than it needed to be. Acceleration pins you to the seat. Because of all wheel drive in the Bentley, our recent snow/rain vacation trip was far more relaxing because road handling was exceptional. This will be the first of many Bentleys!"
bentley,continental-flying-spur,2006,Jesse, 01/21/2006,My Second Bentley,4,"I purchased a Continental GT in late 2004 and was extremely happy with it. Now, the Continental Flying Spur is the same car with more space and some added features.  The bluetooth phone (RAZR) works great.  I also like the cooling solar panel in the sliding roof, air cooled seat not just heated, very large trunk space, and more glass. This is a really great car to drive since it handles like a GT. It has a tight body with no rattles. Overall, the Flying Spur is superb."
bentley,continental-flying-spur,2006,craig29, 03/15/2006,Exquisite,4,"I'm totally excited about this car.  I've had and driven just about everything luxury and they all pale in comparison.  The Continental Flying Spur has plenty of room, power and styling.  My only complaint is that the bluetooth only works with Nokia phones and my Razer doesn't work on the system."
bentley,continental-flying-spur,2006,MaffiaDude, 04/20/2006,Will Never Buy A Mercedes Again!,5,"This vehicle is amazing.  I have previously ownes an S55 AMG and a CL500 and this car put's both to shame. When you press the start engine button it sounds a like an airplane engine starting. When you're going fast you think you feel as if you are going only 45 mph. It is a must have for any person wanting to ride in style. All of the seats massage you, plus they all have heating and cooling. The trunk is so big you could easily fit 6 bodies in there."
bentley,continental-flying-spur,2006,Charles, 01/15/2006,Old World Quality With Modern Dynamics,4,"Was looking for something different than the Bangle-Butt BMW's and mundane Mercedes S-Class, which are like VW's around Los Angeles.  With it's distinctive elegant shape, outstanding build quality, sheer luxury, twin-turbo 550 HP performance, and great driving dynamics, the Flying Spur sits by itself at the top of the luxury sedan heap.  It's an amazing balance of understated capability, able to take five people in total comfort at up to 195 MPH (where, I don't know!), corner with SL's on Angeles Crest, and cruise Sunset Blvd. with the same quiet refinement of a Rolls Phantom, without the Kenworth-grill pretense.  As modern as an A8 Audi (it's cheaper cousin), the Flying Spur make no excuses!"
bentley,continental-flying-spur,2006,Texas driver, 09/07/2006,Bently Continental Flying Spur,4,"I had less than 1,000 miles on this car and it had to be taken in for service twice.  The wheels were not balanced properly for the first visit.  The air conditioner went out in 100 degree temps on a road trip.  It is a lovely car other than those problems, but it makes one wonder what is next.  There is a fabulous sound system on the car.  But the interior storage space is not large enough.  If I put in an XM radio, I would lose my one ashtray.  There is nowhere for change if that is gone.  It drives beautifully.  I can't wait to get out on the open road with this car. "
bentley,continental-flying-spur,2006,Michael, 06/21/2006,Sheer Pride,4,"Let's face it all cars are good these days and our expectations are equally high, but no other car can give me the great sense of pride I feel when I walk up to my Bentley. It just oozes class and quality, and judging by the finger marks on the glass after parking in public others think (or wish) the same."
bentley,continental-flying-spur,2006,jeff, 02/11/2006,Flying Spur is a Pleasure,5,The Bentley Continental Flying Spur is absolutely the best vehicle I have ever driven.  My Arnage is in the garage more now than ever before.  I drive it almost every day and look forward to many years of enjoyment. Thank you Bentley for this vehicle.
bentley,continental-flying-spur,2006,robert annenbaum, 07/03/2006,Upgraded Volkswagen,4,"I was treated better at the Mercedes and BMW dealerships than I was at the Bently dealer. This car has exhilarating performance but lacks the technology that Mercedes or BMW have.  I needed to add satellite radio and I had to buy a special phone to work with the ""optional phone system"" to integrate with the car system.  Bentley you should be ashamed of yourselves nickel and diming your customers like that.  It has panache and if that is worth $40,000 more to you than owning the other cars that I described, then buy it. "
bentley,continental-flying-spur,2006,Robert C., 05/22/2006,Two Thumbs Down,1,"Parple Lossh knows what he's talikng about! I don't like my Bentley either. It's extremely uncomfortable. I would rather have a Mercedes-Benz S600. Everyone has their own opinion, of course."
bentley,continental-flying-spur,2006,Bentley Owner, 06/01/2006,"The Car is Amazing ... YEAH, RIGHT!",1,"O.K. So everyone might think that Bentley has a good name, and they do. I love my Continental GT, but my Flying Spur is a joke. In other words, It's garbage. I bought it, spent a week with it, then returned it. I bought myself a BMW 760Li and now, because of my Flying Spur, am thinking of swapping it in for a Mercedes Benz SLR McLaren or a Mercedes Benz CLK 55 AMG, or maybe a SL 65 AMG. I don't know. Despite it's ""luxury"" name, I find my Audi A6 to be more luxurious. Everyone, though, is subjected to their own, personal opinion.  "
bentley,continental-flying-spur,2006,rick larson, 06/06/2006,Forget It,1,"Given that the Bentley arrived at the lot in December, but I got to give the car a good drive a couple of days ago, you might be wondering where it's been. Well guess what, it was in the shop. You can see it's not reliable at all, considering that the engine burned up twice, a lot of the technology, and etc., etc., etc. It also lags in acceleration. For those who are looking for a Supreme Luxury Car, look at the A8 W12 L or 760 Li. Right now, I've got a 760 Li in the making. "
bentley,continental-flying-spur,2006,Parple Lossh, 05/09/2006,I Am Disappointed,1,"Never a Bentley Again!  I've had it for a while now, and I think it's awful. It is so uncomfortable and heavy. I could have saved $40,000 and gotten a 2007 Mercedes Benz S600 and have been happier than I am with the vehicle that I purchased. For those who are looking for a luxury vehicle, look at the S600 or the Audi A8 W12 L more carefully. Everyone has their own opinion, though."
bentley,continental-flying-spur,2006,CaliforniaCarsOrg, 04/23/2006,Not Quite As Good As The...,3,"Mercedes Benz S600 or the BMW 760Li. The handling was fine, but we were a bit suprised to find out that the garage door opener is optional. This luxury car is beautiful, but if you want to buy an exotic luxury car, look at the S600 or the 760Li or the Audi A8 W12 L as well. The car is a bit heavy, so it didn't perform as well as it could. It's also uncomfortable in the rear seats, compared to the BMW 760Li. In some cases, it's better than the S600 and the 760Li, but overall, it's not quite as good."
bentley,continental-flying-spur,2006,Treo, 07/02/2006,"Its great, but...",3,"The car's performance rocks, it is just that now they have the Chrysler 300 with the exact same front grille (am I the only one that notices it?). The garage door opener is a disgrace, since it's not standard. The radio and navigation are great, and the comfort is great as well. It's a gas guzzler, alright (how does the 760Li get 22 mpg and S65 AMG 18 mpg?) Even though I love my Bentley a lot and probably would recommend this car, I'd recommend a Mercedes-Benz S600 or S65 more. "
bentley,continental-flying-spur,2007,2TimeBentleyOwner, 01/04/2017,"SAVE A BUNDLE - BUY ONE USED, SOLID PERFORMER",5,"Bought our 2007 used in 2016. Car was in great shape with 51,000 miles on it.  Paid $1,600 for Dealer to do maintenance of oil & filter change, and total review of car (more than a standard oil change at dealer, but did more as to changing out fluids, batteries in keys, etc. - was worth it to find out exactly what the car really needed)  Had about 10% left on Brakes. Replaced Brakes AND Tires (got them from Tire Rack) and went to independent mechanic to get things done (ABOUT HALF what Dealer would have charged)  The Trick with these cars is that you DON'T go to the Dealer - you go to good mechanic who knows Bentleys. Had an 1989 Bentley Eight for 20 years and traded it in for this one.  This car is SUPER fast and is comfortable. Better gas mileage than the 1989 BUT, you don't buy one for the Gas Mileage.  After putting on about 7,000 miles in a half-year, I would say it was a great buy.  No way could we afford a new one (total price w/tax about $240,000) but getting this car at $62,000 was a good deal. Oil Change is once every 10,000 (Synthetic oil, 14 quarts - YES 14)  It is a racing engine on a luxury platform. So much better than a Mercedes, BMW, or other High-end car. Repairs? So far just put on Brakes and Tires to insure we had solid traction.  Have had it up to 120MPH and it's like you are driving 55MPH.  I am surprised at some of the other negative comments. Maintenance is not bad if you DON""T go to the dealer.(and that is true on ANY car!!)  Find a good mechanic.  Join the Bentley Club and the Rolls-Royce Owners Club and you will get great tips in maintaining the car and not overpaying for service.  Bottom line - You're driving up in a high-performance Bentley and that makes everyone's Lexus, BMW, Mercedes, and Audi pale in comparison.  No one asks what year it is - it's a Bentley!

UPDATE: At 61,000 miles on the car.  Great car that gets a lot of notice.  Had a sensor problem with the Parking Brake warning going on. Very minor replacement (sensor).  Looking forward to entering it into the Rolls-Royce Owners Club's Regional Concours.  Glad we bought it.  If you buy one - DRIVE IT.  Don't let it sit in the garage.  These cars were built to be driven hard.

UPDATE:  At 62,300 miles on car.  Still great driving.  Had the air struts start losing pressure in the front. (this is the BIG repair that scares anyone from buying some of the exotics - not just Bentley, but high-end Mercedes and others as well). The air struts are like $2,800 apiece and the compressor is $1,100 PLUS installation at the dealer.  You're looking at about a $10-12K repair.  If you shop-around like I did, you can beat that price AND get quality parts (NEW - NOT refurbished) for a LOT LESS.   I bought a total kit for about $2,500 - BOTH Air Struts AND the Compressor. Even my mechanic said I got a steal on it.  I did not need to replace the compressor so I am saving that for the future but my total bill with installation was around $3100 (and I still have the new compressor in a box for the future).  That is  the way you can afford running a high-end exotic and not worrying about maintenance costs. That is the biggest repair on the car.  By a quality used car and learn how to be a  ""shopper"" and you can pull up in a true luxury performance car that originally cost $230,000 next to the guy who paid the same price for a mid-level, nothing spectacular  BMW new.

UPDATE - Have had car for a little over 2 years now.  Going for an oil change.  Great ride.
"
bentley,continental-flying-spur,2007,cuircaleche, 08/13/2008,The most fun you can have with a 4 door,4,"Having owned a variety of high performance sedans over the years, and tired of being nickled and dimed to death by my 600SEL, I thought I'd try something FAST with AWD. For not so much more than it's Audi sibling, the Bentley fit the bill. While it does have some electrical issues, none have been disabling. The ride is a bit noisy due to the high tire pressures and high performance tires. That said, the car is fairly quiet on the road. The 2009 models will be quieter. Acceleration is amazing, the interior is a wonderful place to be, and the car is quite easy to drive. The bluetooth is useless for Verizon customers. "
bentley,continental-flying-spur,2007,lovecars11, 07/21/2011,snakes in paradise,3,"Fast, smooth, comfy,and commodious, we loved this car until Bentley US refused to correct a speedo off by 7%, failed to correct peeling paint (on a $200,000+ car???!!!), and failed to ethically address additional issues with this vehicle.
After 4 years with this car, we wish we'd never purchased it.
It often throws codes on startup, which will get expensive when the extended warranty expires.
Poor warranty service/aftercare is a nightmare on any item.
On a vehicle at this price point, it is an outrage.
It can be great fun to drive for such a huge sedan, but, without proper, kind, and ethical factory support, it's nothing more than atarted up piece of garbage we wish we'd never purchased"
bentley,continental-flying-spur,2007,lovecars11, 09/06/2011,10 reasons not to buy a Bentley,3,"Nice to drive with quite enough power (until one drives a Speed version). Good ride and comfy cabin. All that is marred/spoiled by Bentley Motors' hateful behavior towards it's customers. My Flying Spur (which, when we purchased it, had never been owned by anyone but Bentley Motors and the dealer) now has paint peeling in a bunch of places, an inaccurate speedo, an inaccurate odometer, throws codes seemingly at random, and is now plagued by a shrill noise in the cockpit the dealer was too busy to fix prior to a 7000 mile trip. For us at least, owning a car is not just owning a car, it's an experience and a relationship. The folks at Bentley Motors have been so hateful and pompous that the en"
bentley,continental-flying-spur,2008,luvwater, 11/15/2010,Amazing experiance,4,"That 552 HP engine will leave you breathless, great sedan, comfort and performance are second to none, my two daughters 2 and 3 yo in their car seats have plenty of space watching their DVDs while I enjoy this magnificent ride, if you are thinking about buying one, I say do it today."
bentley,continental-flying-spur,2008,Pat conte, 07/04/2016,Owner,4,"Excellent car
"
bentley,continental-flying-spur,2009,Gil Knauer, 07/31/2010,Gil,4,This is a great automobile. I had the '06 model before this. The '09 is markedly superior. Fairly quiet for a twin turbo 12 cyl.
bentley,continental-flying-spur,2009,Libra_2009, 07/24/2009,"Great car, love it",4,This is my third Bentley and this one has to be my favorite! It has amazing handling as it should. The headrests dvd systems make the car more lovable! I will definitely be keeping this one for a while.
bentley,continental-flying-spur,2010,Anonymous, 12/07/2010,Behind the Times,4,"All in all its a good car, but the car just isn't up to par with the competition. For starters, the technology just does not belong in the 21st century. All the competitors are  far more advanced. The rear seat is a big drawback to, as the seat to low to the ground and lacks thigh support. The car has also been in the shop alot, and the repairs take a long time."
bentley,continental-flying-spur,2012,sebring101, 07/30/2011,Surprisingly Affordable,5,The dealer made this very easy to buy. Very nice buying experience-I was able to negotiate and pay my price. I was a little dubious about buying this vehicle but when you put your foot on the accelerator and feel the movement the exhilaration is more than rewarding. Handles like a dream. You are in control every step of the way. Plenty of room and easy to adjust settings. Everything is intuitive. You do not need the owner's manual. Nothing is hidden. It is all up front and works like a charm. No MBA required. Comfort is unbelievable. Interior is first class as is the fit and finish. It's a very German car without all the quirkiness and regimentation of a Mercedes. Loose and fluid. Easy.
bentley,continental-flying-spur-speed,2012,Mark, 08/03/2015,over rated car ?,5,"I have had several high end cars, my main focus is 4 door luxury sedan, combined with performance, this is my 2nd flying spur, 1st one was a 2006 model, 25k miles, this car gave me a lot of problems, mainly confined to the info-tainement system, though a few major engine problems did occur.
Luckily it was under warranty, good job because it cost 20k plus had the front struts replaced, i sold it within 2 years.
I purchased a high end Mercedes AMG SUV, what a mistake, how i missed the bentleys serene ride,composed road manners, the overall feeling of luxury, and secure ride. I had to buy another, there are no words to describe how it feels, other cars just don't compare.
The Bentley is a very simple car  , there is no lane departure, brake assist,forward cameras, in fact you feel short changed in that department, but it you will not miss them, the is a simple elegance the other cars don't have, or replicate.

So i purchased the best i could, 2012 Speed, what an improvement on the 2006, much better car all round, more power, better seats, handling, just great.
Buy warranty if you can, or good after market service repair, low miles,  good service records are essential, and then enjoy the best ride of you life, in a way i regret getting the car, as everything else seems boring, and mundane, for the price of a new Cadillac Escalade, a used one makes sense, my car was $240k when new 3 years ago, i saved $135K over new, what a bargain. You only live once, go for it.
"
bentley,continental-gt,2004,Larry W, 07/09/2007,Bentley Continental GT,4,"Fantastic and reliable car.  Fun to drive. Very fast with excellent handling.  It is beautiful inside and out.  An every day car with class.  In almost 3 years of daily driving, no problems."
bentley,continental-gt,2004,bentley lover, 10/17/2004,Awesome Car,5,"Best car i everd owned. IF you have the 
money and your in the market for a 
coupe this is definately the car for 
you. Very fun to drive especially in a 
open road where you can really open it 
up."
bentley,continental-gt,2004,Normboat, 10/16/2004,Best Car Ever!,4,"   The most unbelievable vehicle I have 
ever driven, much less owned.  It makes 
most other cars toy-like, and shows the 
marked difference between cars.  Blows 
away others.  A true wonder of the 
combination of engineering and luxury."
bentley,continental-gt,2004,Bentley Auto Fanatic, 07/05/2004,Bentley Cont GT,2,"Although the styling is very 
attractive, I am disappointed with the 
interior finishes as there is rattling 
and squeaking from the interior. The 
knobs/switches are rather cheesy 
considering the Bentley name and price 
of the car. Also the car has too much 
of a heavy feel on turns."
bentley,continental-gt,2004,bentlyguy97, 10/21/2004,Bently Continental GT,5,"This car is amazing.  To anyone looking 
to purchase such a luxary car that 
still performs, you will be very happy 
with this car.  And to those of you 
that already have one all I can say is 
HAVE FUN!!!!!!!!"
bentley,continental-gt,2004,Joel, 04/05/2006,2004 Bentley Continental,4,The 2004 Bentley Continental is an excellent car.  It is fun to own.  o Mine has had no problems.
bentley,continental-gt,2004,Rick Collins, 08/09/2004,My Bentley,4,"My Bentley is great.  I just purchased 
three new cars, two for me and one for 
my wife.  My wife has a Mercedes SL600, 
I havea BMW 760Li and my Bentley.  My 
Bentley is by far my favorite car.  I 
have it in the colors featured on the 
Edmunds site.  I am 50 years old, and I 
remember lots of the old Bentleys, and 
this one is a blast from the past."
bentley,continental-gt,2004,Mark Adams, 11/07/2004,bently,5,this is a great car.
bentley,continental-gt,2004,EMB, 08/24/2005,The Perfect Car,4,"I have always been a Porsche owner, but ever since I purchased the Bentley GT, I don't even remeber what a Porsche looks like! I love everything about this car; great looks, tons of room and monster engine."
bentley,continental-gt,2004,Pattsy Taylor, 09/09/2004,Pattsys Baby Bentley,4,"I love my Bentley very much because it 
drives so well and plus it drives real 
smooth on the road. I have recently put 
some 23's on my bentley and I am loving 
it a lot. I am thinking about getting 
my husband one for his 35th birthday."
bentley,continental-gt,2004,carlover2000000, 09/25/2004,Car carlovers must have,4,"wonderful design along with great 
features"
bentley,continental-gt,2004,dajavoo, 09/06/2004,continental GT,4,"Superb Vehicle, gives a presence of 
dominance on and off the road!"
bentley,continental-gt,2005,JerryD05CGT, 12/11/2015,"Gorgeousted car, electrical nightmare!!",3,"Phenomenal looking car. Love driving it, but I don't often because it lives in the shop. The 2005 has evil electrical gremlins! I got it in December 2014 with 14,800 miles. Two previous owners. First owner had it 8 years and managed to put only 4500 miles on it.  Second owner had it two years and put 9500 miles on it.  I put 4000 miles on it over about 2 1/2 months. Then it just died..literally.   the engine just shut down at a stop sign. Had to disconnect the battery cables to recycle the electrical system. I noticed on the service records that owner number one had a similar issue the first year of ownership.  I parked it for several months then drove it to my independent guy (where it died at a stop light 1/2 mile from the shop). All my sensor lights came on, Windows only rolled half way up. It was a mess. Been with my independent for 4 months  (he's good, but ridiculously slow). He believes it's a module board because he can hear relays clicking off and on in the battery compartment. Love the looks, head Turner of a car but seriously thinking about dumping it when I get it back. Too unreliable....
"
bentley,continental-gt,2005,AlanPMatthews, 12/25/2005,It doesn't get better than this,4,Behaving well at every speed I am constantly amazed that 80 mph in my 2005 Bentley Continental GT feels like 40 and 110 feels like 60. This car is effortless in just about everything it does.  It just keeps on delivering power.  The back seats are a bit of a squash for adults but the kids are fine in them.  The Turbo R feels like a real clunker now!
